{
  "$schema": "https://json-schema.org/draft/2020-12/schema",
  "$id": "https://example.invalid/schemas/event.schema.json",
  "title": "Event",
  "type": "object",
  "additionalProperties": false,
  "required": [
    "schema_version",
    "event_id",
    "title",
    "summary",
    "occurred_at",
    "discovered_at",
    "intelligence_priority",
    "observation_domains",
    "first_order_variables",
    "status",
    "sensitivity"
  ],
  "properties": {
    "schema_version": {
      "const": "0.1.0"
    },
    "event_id": {
      "type": "string",
      "pattern": "^evt-[A-Za-z0-9._-]+$"
    },
    "title": {
      "type": "string",
      "minLength": 1,
      "maxLength": 240
    },
    "summary": {
      "type": "string",
      "minLength": 1
    },
    "occurred_at": {
      "type": "string",
      "format": "date-time"
    },
    "published_at": {
      "type": [
        "string",
        "null"
      ],
      "format": "date-time"
    },
    "discovered_at": {
      "type": "string",
      "format": "date-time"
    },
    "intelligence_priority": {
      "enum": [
        "P0",
        "P1",
        "P2"
      ]
    },
    "observation_domains": {
      "type": "array",
      "minItems": 1,
      "uniqueItems": true,
      "items": {
        "enum": [
          "geopolitical_military",
          "energy",
          "food",
          "water",
          "shipping",
          "fiscal",
          "sovereign_debt",
          "rates",
          "real_estate",
          "banking",
          "capital_flows",
          "climate",
          "natural_disaster",
          "ai_capex",
          "technology_valuation",
          "financing",
          "global_trade",
          "supply_chain",
          "governance",
          "social_stability",
          "physical_ai",
          "other"
        ]
      }
    },
    "first_order_variables": {
      "type": "array",
      "uniqueItems": true,
      "items": {
        "enum": [
          "A",
          "B",
          "C",
          "D"
        ]
      }
    },
    "geography": {
      "type": "array",
      "uniqueItems": true,
      "items": {
        "type": "string",
        "minLength": 1
      }
    },
    "status": {
      "enum": [
        "developing",
        "confirmed",
        "contained",
        "reversed",
        "closed"
      ]
    },
    "evidence_ids": {
      "type": "array",
      "uniqueItems": true,
      "items": {
        "type": "string",
        "pattern": "^evd-[A-Za-z0-9._-]+$"
      }
    },
    "tags": {
      "type": "array",
      "uniqueItems": true,
      "items": {
        "type": "string"
      }
    },
    "model_change_candidate": {
      "type": "boolean",
      "default": false
    },
    "sensitivity": {
      "enum": [
        "public",
        "internal",
        "confidential",
        "restricted"
      ]
    }
  }
}
